{"run":39,"commit":"f26c057","metric":377.69301553489936,"metrics":{"binary_mib":103.84544563293457,"stress_ms":203.52587890625,"real_ms":700.903564453125,"first_visible_ms":147.5816650390625,"first_frame_ms":127.766845703125,"highlighted_ms":805.852783203125,"recovery_ms":12.0823974609375,"peak_rss_mib":282.515625},"status":"discard","description":"Disable release minification while retaining ESM bytecode precompilation","timestamp":1789032297594,"segment":2,"confidence":1.8457753284517469,"asi":{"hypothesis":"Without runtime parsing overhead, unminified code may produce bytecode with better startup execution behavior than minified code","rollback_reason":"Primary377.69ms is2.35% slower than best369.03ms; binary grew101.85→103.85MiB and peakRSS rose275.75→282.52MiB. No measured benefit.","validation":"Full checks and unchanged compiled readiness/navigation pass. The experiment builder now reads explicit boolean minify from the production recipe, so it automatically restores minification after rollback. Bytecode, ESM, workloads, warmups and data requirements unchanged.","next_action_hint":"Do not retry disabling minification unchanged. Keep production minification plus ESM bytecode. Stack discovery has repeated graph walks but is behind an opt-in flag, so do not enable it in fixtures to manufacture startup gains."}}
{"run":40,"commit":"f26c057","metric":443.78683124817735,"metrics":{"binary_mib":101.84556770324707,"stress_ms":246.0283203125,"real_ms":800.50439453125,"first_visible_ms":158.0255126953125,"first_frame_ms":137.838134765625,"highlighted_ms":915.0377197265625,"recovery_ms":10.5115966796875,"peak_rss_mib":282.015625},"status":"discard","description":"Define production NODE_ENV explicitly during release bytecode compilation","timestamp":1789032447631,"segment":2,"confidence":2.107691429470732,"asi":{"hypothesis":"A production-mode compile-time definition may remove development-only dependency branches before bytecode generation","rollback_reason":"Primary443.79ms is20.3% above best369.03ms. Binary size unchanged and no performance benefit established.","observations":"Both medians and first-frame time worsened; real samples704.70–960.45ms indicate noise. Equal binary size suggests the build may already remove relevant development code, but size alone does not prove identical output.","validation":"Production recipe and measurement builder use the same optional definition. Full types/tests and compiled readiness/navigation passed. Data, warmups and observer semantics unchanged. Builder follows reverted source definition automatically.","next_action_hint":"Do not retry this flag unchanged. Recent runs show higher first-frame and startup times even for small changes; use a fresh retained-code control before attributing further small effects."}}
{"run":41,"commit":"f26c057","metric":408.2457140365709,"metrics":{"binary_mib":101.84556770324707,"stress_ms":227.094482421875,"real_ms":733.899658203125,"first_visible_ms":157.8350830078125,"first_frame_ms":131.28759765625,"highlighted_ms":838.4337158203125,"recovery_ms":11.594482421875,"peak_rss_mib":277.390625},"status":"discard","description":"Rebuild retained code as a control after recent slower experiments","timestamp":1789032521024,"segment":2,"confidence":2.425346659497341,"asi":{"hypothesis":"Recent slower results may partly reflect environmental variation rather than candidate changes; test unchanged retained code with a fresh rebuild","rollback_reason":"Control408.25ms is10.6% above best369.03ms. No application changes were made or need reverting.","observations":"Retained code is also slower: real733.90ms vs672.46ms, stress227.09ms vs202.51ms. Pre-run load averages4.91/6.49/6.87 vs2.37/2.90/3.85 at run36. This supports environmental variation but does not identify its exact cause or validate discarded candidates.","validation":"jj diff confirmed no source or release-recipe changes before run. Same compiled flags, warmups, workloads, readiness and full passing checks. Binary size101.85MiB unchanged.","next_action_hint":"Do not attribute recent small regressions solely to candidate code or treat historical best as a stable current baseline. Prefer adjacent controls for the next substantial optimization; do not retest discarded ideas solely to chase a lucky minimum."}}
{"run":42,"commit":"f26c057","metric":414.06308014919017,"metrics":{"binary_mib":101.84556770324707,"stress_ms":223.695068359375,"real_ms":766.437255859375,"first_visible_ms":156.610595703125,"first_frame_ms":135.3682861328125,"highlighted_ms":855.4381103515625,"recovery_ms":11.76416015625,"peak_rss_mib":277.8125},"status":"discard","description":"Remove redundant committer-date sorting from bookmark metadata reads","timestamp":1789032630619,"segment":2,"confidence":2.6702853870653307,"asi":{"hypothesis":"Metadata is joined by commit ID and published in original reference order, so repeated committer-date sorting in metadata subprocesses may be unnecessary work","rollback_reason":"Primary414.06ms is12.2% above best369.03ms and1.4% above adjacent unchanged control408.25ms. No measured combined benefit.","observations":"Stress223.70ms slightly below control227.09ms, but real766.44ms above control733.90ms. Removing metadata sorting can also change prefix availability even when final ordering is preserved.","validation":"All17 bookmark target tests passed, including native color/alias/conflict comparisons, out-of-order prefix publication, cancellation and errors. Full suite/types plus unchanged compiled readiness/navigation passed.","next_action_hint":"Do not retry removing metadata sorting unchanged. Stable final ordering alone does not guarantee equally early prefix publication. Prioritize reductions in actual target formatting work rather than changing its order."}}
{"run":43,"commit":"f26c057","metric":512.6501531313984,"metrics":{"binary_mib":101.84556770324707,"stress_ms":301.537841796875,"real_ms":871.566162109375,"first_visible_ms":186.1165771484375,"first_frame_ms":159.4014892578125,"highlighted_ms":999.5308837890625,"recovery_ms":11.6793212890625,"peak_rss_mib":267.796875},"status":"discard","description":"Use coalesce to avoid duplicate bookmark description first-line lookup","timestamp":1789032738529,"segment":2,"confidence":2.425346659497341,"asi":{"hypothesis":"Use coalesce instead of testing and reading the same nonempty target description twice in the jj template","rollback_reason":"Primary512.65ms is38.9% above historical best369.03ms and25.6% above recent unchanged control408.25ms; no demonstrated end-to-end gain.","validation":"All17 bookmark tests plus full types/tests and compiled readiness/navigation passed. No data, ordering, fixture, warmup or observation changes.","observations":"First-frame159.4ms also rose before bookmark description processing, so environmental effects likely contribute. Do not claim the template change caused the full slowdown.","next_action_hint":"Do not retry this template micro-optimization unchanged. Minor changes are not producing measurable wins amid load variation. Seek a larger independently justified reduction before another timing candidate."}}
{"run":44,"commit":"f26c057","metric":471.5000331399285,"metrics":{"binary_mib":101.84556770324707,"stress_ms":278.7666015625,"real_ms":797.4853515625,"first_visible_ms":167.06884765625,"first_frame_ms":146.2667236328125,"highlighted_ms":928.1341552734375,"recovery_ms":12.759765625,"peak_rss_mib":275.328125},"status":"discard","description":"Filter bookmark metadata subprocesses to the required remote group","timestamp":1789032907638,"segment":2,"confidence":2.3756163531781858,"asi":{"hypothesis":"Avoid sorting and visiting unused remote copies during target hydration: use exact remote filters for remote groups and default local-inclusive listing for local groups","rollback_reason":"Primary471.50ms is27.8% above best369.03ms and15.5% above recent unchanged control408.25ms. No demonstrated startup improvement.","validation":"All17 bookmark target tests including native colors, aliases, remote targets, conflicts, fallback, cancellation and publication ordering pass. Full types/tests and compiled navigation/readiness passed. Initial full reference read and data requirements unchanged.","observations":"First-frame146ms remains slower than recent control131ms, so environment remains a confounder. Lower time than previous discarded run is not evidence of an optimization.","next_action_hint":"Do not retry this filtering change unchanged. Further work needs direct evidence of a dominant remaining cost rather than more metadata CLI flag variations."}}
{"run":45,"commit":"f26c057","metric":504.2017405682835,"metrics":{"binary_mib":101.84556770324707,"stress_ms":288.362548828125,"real_ms":881.596435546875,"first_visible_ms":199.1180419921875,"first_frame_ms":174.539794921875,"highlighted_ms":1019.4727783203125,"recovery_ms":11.6754150390625,"peak_rss_mib":281.453125},"status":"discard","description":"Avoid reparsing already streamed bookmark metadata at process completion","timestamp":1789033054632,"segment":2,"confidence":2.206523003023085,"asi":{"hypothesis":"Final metadata process events repeat the full stdout already parsed incrementally; parse only the pending line and any unstreamed suffix","rollback_reason":"Primary504.20ms is36.6% above historical best369.03ms. No measured startup benefit.","observations":"First-frame174.54ms is also elevated before metadata parsing; environment remains a major confounder. This candidate concerned the final duplicate parse in the newer shared metadata path, not the previously discarded whole-reference incremental parser.","validation":"All17 target tests including native output comparisons, fallback, errors and cancellation passed. Full types/tests and unchanged compiled readiness/navigation passed. No required data omitted.","next_action_hint":"Do not retry final metadata parse optimization unchanged. Stronger cost evidence or a larger structural reduction is needed; do not interpret rising pre-content timings as parser regressions."}}
{"run":46,"commit":"f26c057","metric":397.55034979544706,"metrics":{"binary_mib":101.84556770324707,"stress_ms":215.908203125,"real_ms":732.0068359375,"first_visible_ms":148.41552734375,"first_frame_ms":129.6456298828125,"highlighted_ms":844.481689453125,"recovery_ms":10.088623046875,"peak_rss_mib":274.4375},"status":"discard","description":"Recheck unchanged retained code after elevated first-frame timings","timestamp":1789033146410,"segment":2,"confidence":2.129971784811656,"asi":{"hypothesis":"Rising first-frame times in recent candidates may be transient rather than a stable new performance level; measure retained code without changes","rollback_reason":"Control397.55ms is7.7% above historical best369.03ms. No application changes made or reverted.","observations":"First-frame129.65ms returns near earlier control131.29ms despite pre-run load averages14.75/12.08/9.66. Primary is also near prior unchanged control408.25ms. Load averages alone are not a reliable predictor of individual launch timings. These controls do not establish that discarded micro-optimizations help.","validation":"No source or production recipe diff before measurement. Fresh rebuild, identical warmups, fixtures and readiness; all checks passed.","next_action_hint":"Use397.55ms as a nearby control observation, not a replacement baseline. Next candidate should have a demonstrated substantial cost reduction; avoid random knobs and repeated unchanged controls without a new uncertainty to resolve."}}
{"run":47,"commit":"f26c057","metric":385.10148754045235,"metrics":{"binary_mib":101.86131477355957,"stress_ms":207.538818359375,"real_ms":714.580322265625,"first_visible_ms":151.85595703125,"first_frame_ms":129.025634765625,"highlighted_ms":822.649658203125,"recovery_ms":10.918212890625,"peak_rss_mib":279.828125},"status":"discard","description":"Suppress local-bookmark consumers for remote-only batches using identity-aware memo equality","timestamp":1789033286625,"segment":2,"confidence":2.267006562059986,"asi":{"hypothesis":"Stable reference identities from shared metadata hydration let a memo suppress local-selection and PR-query work when a batch only adds remote references","revisits_run":8,"changed_assumption":"Earlier simple filter memo preceded shared hydration and did not compare filtered arrays by identity. Current prefix publication preserves prior bookmark objects, enabling equality to prevent downstream effects, not just avoid repeated filtering.","rollback_reason":"Primary385.10ms remains4.4% above historical best369.03ms, so discard under session rules. It is3.1% below nearby unchanged control397.55ms, but that small difference is not sufficient causal evidence.","validation":"Full tests/types and compiled navigation/readiness passed; formatting passed. No readiness, data, fixture or warmup changes. Replaced local objects still invalidate the memo, preserving refresh updates.","observations":"Both workload medians below nearby control: stress207.54vs215.91ms, real714.58vs732.01ms; first-frame essentially equal129ms. Potentially useful downstream-work reduction, not an established startup win.","next_action_hint":"Do not keep based solely on the adjacent-control improvement or rerun until lucky. If revisited with new evidence, first add a deterministic SyncProvider test counting PR reads for remote-only batches and verify real refreshing still updates metadata."}}
{"run":48,"commit":"f26c057","metric":395.6422164233108,"metrics":{"binary_mib":101.86131477355957,"stress_ms":221.159423828125,"real_ms":707.782470703125,"first_visible_ms":149.7916259765625,"first_frame_ms":128.3603515625,"highlighted_ms":823.3302001953125,"recovery_ms":9.9364013671875,"peak_rss_mib":280.15625},"status":"discard","description":"Stop the visible-bookmark scan once the requested local prefix is complete","timestamp":1789033416706,"segment":2,"confidence":2.373301161838992,"asi":{"hypothesis":"Avoid filtering every loaded reference on each visible-bookmark update when only a bounded local prefix is requested","rollback_reason":"Primary395.64ms is7.2% above historical best369.03ms and only0.5% below recent unchanged control397.55ms; no conclusive startup gain.","validation":"Added deterministic tests for equivalence to filter/slice across interleaved references and unusual limits, reference identity, and stopping after the requested prefix. Full tests/types and compiled navigation/readiness passed. Full state and load-more limits unchanged.","observations":"Real707.78ms below control732.01ms but stress221.16ms above215.91ms. Reduced scans are demonstrable, but end-to-end benefit is not.","next_action_hint":"Do not retry this bounded scan unchanged. Startup gains need more than reducing cheap array scans; retain measurement semantics and seek larger costs."}}
{"run":49,"commit":"f26c057","metric":383.88622604808177,"metrics":{"binary_mib":101.86131477355957,"stress_ms":211.056396484375,"real_ms":698.242919921875,"first_visible_ms":149.0572509765625,"first_frame_ms":129.3642578125,"highlighted_ms":811.0225830078125,"recovery_ms":12.443603515625,"peak_rss_mib":279.96875},"status":"discard","description":"Suppress duplicate full-bookmark signal publications by reference identity","timestamp":1789033534068,"segment":2,"confidence":2.222484775328942,"asi":{"hypothesis":"The final shared metadata result reuses objects from the final batch; signal equality can avoid repeating all bookmark consumers for identical snapshots","rollback_reason":"Primary383.89ms remains4.0% above historical best369.03ms. It is3.4% below recent unchanged control397.55ms, but this does not establish a repeatable gain.","validation":"Full tests/types and compiled readiness/navigation passed. Equality checks every object and its order, not only names or IDs; new objects still invalidate. No completion hooks, data requirements or benchmark settings changed.","observations":"Broader than run47: equality on full source signal suppresses duplicate final snapshots for all consumers, not just local-only batches. Both workload medians slightly below recent control; first-frame essentially identical.","next_action_hint":"Do not retry this equality change unchanged or chase a historical minimum. A future follow-up needs deterministic consumer-count tests and adjacent repeated A/B evidence before claiming benefit."}}
{"run":50,"commit":"f26c057","metric":403.7886502711371,"metrics":{"binary_mib":101.84556770324707,"stress_ms":214.14794921875,"real_ms":761.367431640625,"first_visible_ms":157.61962890625,"first_frame_ms":130.85888671875,"highlighted_ms":843.5025634765625,"recovery_ms":10.9058837890625,"peak_rss_mib":282.921875},"status":"discard","description":"Following unchanged-code control for bookmark signal-equality candidate","timestamp":1789033622716,"segment":2,"confidence":2.431314218309678,"asi":{"hypothesis":"The signal-equality candidate's improvement over an earlier control may reflect timing drift; a following unchanged-code control tests that uncertainty","rollback_reason":"Control403.79ms is9.4% above historical best369.03ms. No application changes were made.","observations":"Run49 candidate383.89ms is below both earlier control397.55ms and following control403.79ms. This is suggestive but not decisive: real-repository control samples685.73–859.55ms remain variable. Candidate remains discarded under historical-best rule; do not claim a proven gain.","validation":"No app or production recipe diff. Fresh minified ESM-bytecode build, same warmups/workloads/readiness and all checks passed.","next_action_hint":"Further work on signal equality should first measure actual suppressed consumer counts with deterministic integration tests, not repeatedly time the same patch hoping to beat the historical minimum. No further unchanged controls needed for this comparison alone."}}
{"run":51,"commit":"f26c057","metric":378.1774531293766,"metrics":{"binary_mib":101.86131477355957,"stress_ms":205.9423828125,"real_ms":694.457275390625,"first_visible_ms":147.2623291015625,"first_frame_ms":126.3685302734375,"highlighted_ms":804.9053955078125,"recovery_ms":9.9248046875,"peak_rss_mib":277.453125},"status":"discard","description":"Combine full-snapshot and local-list identity equality with verified PR-query suppression","timestamp":1789033828338,"segment":2,"confidence":2.305278193218426,"asi":{"hypothesis":"Combining source-snapshot and local-list equality removes redundant consumer work at both remote-only batch publication and final completion","revisits_run":49,"changed_assumption":"New integration test first failed on retained code due to a second PR read after a remote-only batch, then passed with combined equality. Updated local objects still trigger a fresh read and visible description update. This is a combined candidate with direct work-reduction evidence, not an unchanged timing retry.","rollback_reason":"Primary378.18ms is2.5% above historical best369.03ms, so discard under session rules despite being6.3% below immediately preceding control403.79ms.","validation":"Deterministic real SyncProvider integration test plus full types/tests and compiled readiness/navigation passed. Same complete data, warmups and release flags. Patch and regression test saved in .auto/bookmark-publication.patch.","observations":"Both workload medians below preceding control: stress205.94vs214.15ms and real694.46vs761.37ms. Demonstrated query suppression is stronger evidence than timing alone, but this run does not beat the historical minimum.","next_action_hint":"Preserve as a separate efficiency improvement lead, not repeatedly rerun to chase the historical best. A fixed-best retention rule can reject real improvements under timing drift; do not silently change that rule or benchmark."}}
{"run":52,"commit":"f26c057","metric":380.38156672355615,"metrics":{"binary_mib":101.84556770324707,"stress_ms":207.138427734375,"real_ms":698.51904296875,"first_visible_ms":149.09423828125,"first_frame_ms":128.177490234375,"highlighted_ms":808.7037353515625,"recovery_ms":9.036865234375,"peak_rss_mib":276.671875},"status":"discard","description":"Publish final expanded log-page commits, pagination and selection in one Solid batch","timestamp":1789033953325,"segment":2,"confidence":2.502750405123795,"asi":{"hypothesis":"Batch final loadMoreLog state setters so consumers do not recompute between commit, hasMore and selection updates","rollback_reason":"Primary380.38ms is3.1% above historical best369.03ms. Below recent control403.79ms but not a demonstrated repeatable win.","validation":"Full types/tests and compiled navigation/readiness passed. Stream timing and contents unchanged; no readiness hook edits. Matches batching already used by regular loadLog completion.","observations":"Stress207.14ms and real698.52ms are close to previous unrelated candidate205.94/694.46ms, consistent with shared environmental variation rather than a large unique batching gain. No direct proof of avoided redundant prefetch collected.","next_action_hint":"Do not retry batching unchanged. If pursued as a correctness improvement separately, first construct a deterministic exhausted-page test showing no intermediate-state consumer or extra fetch."}}
