{"type":"config","name":"Kajji real TUI startup across stress and real repositories","metricName":"startup_ms","metricUnit":"ms","bestDirection":"lower"}
{"run":1,"commit":"6246320","metric":1862.045904,"metrics":{"stress_ms":1028.813477,"real_ms":3370.110352,"highlighted_ms":2578.213501,"first_frame_ms":879.108887,"recovery_ms":7.843994},"status":"keep","description":"Baseline: fixed real TUI startup on stress and copied real repository","timestamp":1788966366756,"segment":0,"confidence":null,"asi":{"hypothesis":"Establish comparable fresh-process baseline before changes","observations":"Real fixture is stable at 3.37s; stress samples range 966–1282ms. Tests and typecheck pass.","reports":".kajji-benchmarks/startup-auto/20260909-170501"}}
{"run":2,"commit":"6246320","metric":2319.638035,"metrics":{"stress_ms":1454.317139,"real_ms":3699.826172,"highlighted_ms":3027.849731,"first_frame_ms":1021.524292,"recovery_ms":11.811157},"status":"discard","description":"Parse only new bookmark stream lines instead of reparsing the full prefix","timestamp":1788966505104,"segment":0,"confidence":null,"asi":{"hypothesis":"Incremental bookmark parsing reduces repeated allocations for large bookmark streams","rollback_reason":"Primary startup increased 24.6%; both workloads worsened. First-frame delay also increased, so environmental variation may contribute; no measured benefit.","next_action_hint":"Investigate startup import cost and subprocess critical path rather than parser micro-optimizations","implementation":"Maintain pending incomplete line plus immutable concatenated bookmark batches; retain final authoritative parse."}}
{"run":3,"commit":"435598b","metric":1826.582116,"metrics":{"stress_ms":1012.089355,"real_ms":3296.549072,"highlighted_ms":2519.379272,"first_frame_ms":889.228638,"recovery_ms":12.589478},"status":"keep","description":"perf: overlap repository inspection with application module loading","timestamp":1788966757367,"segment":0,"confidence":1,"asi":{"hypothesis":"Start repository inspection before importing the full App component graph; await both before rendering","observations":"Primary improved 1.9%, but sample ranges are wide and first-frame median did not improve. This requires a repeat; no strong speed claim yet.","validation":"Unit tests and typecheck pass; rendering still waits for both modules and repository inspection."}}
{"run":4,"commit":"504d33f","metric":1730.73863,"metrics":{"stress_ms":984.117432,"real_ms":3043.799561,"highlighted_ms":2380.752319,"first_frame_ms":833.644653,"recovery_ms":12.843262},"status":"keep","description":"Repeat the application-import overlap candidate without code changes","timestamp":1788966825578,"segment":0,"confidence":2,"asi":{"hypothesis":"Check whether the initial small improvement repeats","observations":"Repeat is faster, but unchanged code varied from 1827 to 1731ms. Need an A comparison before assigning the full improvement to code.","next_action_hint":"Test original static App import as A; retain fixed measurement and fixtures."}}
{"run":5,"commit":"504d33f","metric":1757.42255,"metrics":{"stress_ms":971.545166,"real_ms":3178.991699,"highlighted_ms":2433.316528,"first_frame_ms":836.612915,"recovery_ms":11.287109},"status":"discard","description":"A comparison: restore static App import to test attribution","timestamp":1788966906597,"segment":0,"confidence":1.898613331379204,"asi":{"hypothesis":"Original static import may perform equally well once environmental variation is accounted for","rollback_reason":"Original static import is 1.54% slower than best candidate aggregate; restore candidate","next_action_hint":"Look for a larger deterministic reduction. Import overlap evidence is small, not a 7% proven gain.","observations":"A improved relative to first baseline too. Stress faster than candidate; real slower. Environmental drift accounts for much of initial apparent gain."}}
{"run":6,"commit":"afe46da","metric":1712.482635,"metrics":{"stress_ms":921.011475,"real_ms":3184.104492,"highlighted_ms":2402.792847,"first_frame_ms":820.840332,"recovery_ms":12.034424},"status":"keep","description":"perf: reuse bounded ANSI parsing cache for bookmark stack rows","timestamp":1788967008882,"segment":0,"confidence":2.2780652502160694,"asi":{"hypothesis":"Use the shared bounded parse cache instead of recreating a terminal parser for identical bookmark row text","observations":"Primary improved 1.05% from prior best; real workload worsened 4.6% while stress improved 6.4%. Small result needs repeat.","validation":"Tests and typecheck pass. Cache uses same cols=9999 and rows=1, resolves theme colors after retrieval, and is bounded by bytes and entries."}}
{"run":7,"commit":"afe46da","metric":2323.652546,"metrics":{"stress_ms":1501.774414,"real_ms":3595.321045,"highlighted_ms":2962.451416,"first_frame_ms":1124.582886,"recovery_ms":11.357178},"status":"discard","description":"Retry incremental bookmark parsing after ANSI cache change and stream trace inspection","timestamp":1788967155613,"segment":0,"confidence":1.5604948780765342,"asi":{"hypothesis":"Stable bookmark identities plus ANSI reuse may help the observed many-small-batch real workload","revisits_run":2,"rollback_reason":"Again much worse startup, including first frame before bookmark parsing runs. No end-to-end improvement established.","next_action_hint":"Do not retry parser alone again. Investigate why edited source runs have higher first-frame import time and whether source transform caches skew A/B.","observations":"Both runs that edit large jj.ts have high first-frame costs. Same code file size 1200+ lines may have JSX preload transform cache invalidation effects; need inspect compiler cache or sustained repeat before attribution."}}
{"run":8,"commit":"afe46da","metric":1967.50564,"metrics":{"stress_ms":1005.946777,"real_ms":3848.194092,"highlighted_ms":2797.496826,"first_frame_ms":966.435791,"recovery_ms":11.087646},"status":"discard","description":"Memoize local bookmark filtering in sync and bookmark panel","timestamp":1788967298246,"segment":0,"confidence":1.263379294269079,"asi":{"hypothesis":"Avoid filtering all bookmark entries on each selected-bookmark read and panel count access","rollback_reason":"Primary worse than retained best; real samples 3477–4637ms are too variable to demonstrate benefit","next_action_hint":"Prioritize functional checks and source analysis while machine load is high; do not claim small timing changes as wins.","environment":"Observed load average ~12, with Sandbed, WindowServer, Figma and other Pi processes consuming CPU."}}
{"run":9,"commit":"afe46da","metric":1802.114043,"metrics":{"stress_ms":979.001953,"real_ms":3317.27124,"highlighted_ms":2502.378296,"first_frame_ms":831.614136,"recovery_ms":13.333984},"status":"discard","description":"Remove unused ghostty-terminal registration and its startup import","timestamp":1788967488816,"segment":0,"confidence":1.5604948780765342,"asi":{"hypothesis":"Unused renderer extension registration may load avoidable terminal-buffer code","rollback_reason":"Primary 5.2% slower than best; no measured startup benefit","next_action_hint":"Focus on large import modules or subprocess work; shared ghostty root already needed by ANSI parsing may load terminal code anyway","validation":"20/21 E2E checks passed on retained code. File-navigation failure reproduces on base 996dbf68 in /tmp/kajji-startup-e2e-baseline. No tests weakened."}}
{"run":10,"commit":"afe46da","metric":1775.387091,"metrics":{"stress_ms":970.101807,"real_ms":3249.142822,"highlighted_ms":2480.33667,"first_frame_ms":839.856567,"recovery_ms":10.070557},"status":"discard","description":"Use Shiki core imports for the explicit worker language and theme bundle","timestamp":1788967648832,"segment":0,"confidence":2.128484595995136,"asi":{"hypothesis":"Avoid importing the full language/theme registries when all supported grammars are passed directly","rollback_reason":"Primary startup 3.7% slower than best, without a clear highlighting benefit","next_action_hint":"Try Oniguruma engine to remove first-use regex compilation instead of small import changes. Verify language output and compiled worker.","source":"Inspected current /tmp/shiki bundle-factory: full factory delegates to core for explicit grammar/theme objects; semantic equivalence holds for this worker."}}
{"run":11,"commit":"afe46da","metric":1931.970728,"metrics":{"stress_ms":1036.973633,"real_ms":3599.427002,"highlighted_ms":2367.004028,"first_frame_ms":948.832886,"recovery_ms":12.51062},"status":"discard","description":"Use Shiki Oniguruma/WASM engine instead of JavaScript regex conversion","timestamp":1788967742289,"segment":0,"confidence":1.5604948780765342,"asi":{"hypothesis":"Avoid expensive first-use grammar conversion/JIT while preserving TextMate highlighting","rollback_reason":"Primary content startup 12.8% worse than best despite faster syntax readiness","next_action_hint":"Keep as a separate highlighting optimization lead; primary metric here is content, not highlighting. Do not keep solely for secondary win.","observations":"Stress highlighting gap shrinks strongly; full factory uses supported inlined shiki/wasm loader. Tests pass but compiled binary still needs validation before retaining in a future session."}}
{"run":12,"commit":"afe46da","metric":1935.18584,"metrics":{"stress_ms":1042.851807,"real_ms":3591.060791,"highlighted_ms":2702.770874,"first_frame_ms":910.761963,"recovery_ms":13.292358},"status":"discard","description":"Memoize resolved theme colors to avoid repeated color calculations and object allocations","timestamp":1788967861185,"segment":0,"confidence":1.6755109552562988,"asi":{"hypothesis":"Shared memo avoids rebuilding adapted theme colors for every mounted row and span","rollback_reason":"No primary improvement; startup 13% above best","next_action_hint":"Small allocation savings are insufficient for startup target. Inspect substantial pre-render initialization or command duplication instead.","validation":"All unit tests and typecheck pass; colors still react to theme, mode and terminal background."}}
{"run":13,"commit":"afe46da","metric":1775.783116,"metrics":{"stress_ms":959.936279,"real_ms":3285.015625,"highlighted_ms":2487.331909,"first_frame_ms":828.836792,"recovery_ms":11.797119},"status":"discard","description":"Avoid JSX compilation of sync provider through equivalent createComponent call and .ts module","timestamp":1788968017265,"segment":0,"confidence":1.5604948780765342,"asi":{"hypothesis":"Native TypeScript loading avoids Babel transform of 1400-line file with only one JSX expression","rollback_reason":"Primary 3.7% slower than best. No sufficient gain to justify rename and explicit component construction.","next_action_hint":"Stop small source-only changes. Inspect actual jj bookmark command cost or larger import graph deferral with correctness safeguards.","validation":"Same provider value and getter children; unit tests and types pass. Benchmark/readiness code unchanged."}}
{"run":14,"commit":"1378bfb","metric":1355.938151,"metrics":{"stress_ms":998.734619,"real_ms":1840.897705,"highlighted_ms":1784.473389,"first_frame_ms":926.449097,"recovery_ms":9.656982},"status":"keep","description":"perf: share bookmark target descriptions across pinned reference reads","timestamp":1788968680128,"segment":0,"confidence":5.457425984564791,"asi":{"hypothesis":"Evaluate expensive target empty/description formatting once per unique commit rather than once per local and remote reference","observations":"Real startup falls to 1841ms from prior 3184ms; primary improves 20.8% vs prior best, despite slower first frame. Stress remains about 1s.","correctness":"Compared full Bookmark arrays against original template for both fixtures, with default and custom scoped colors/ID aliases: exact equality. Original fallback retained for conflicted/deleted refs and unpinned reads. Tests and types pass.","implementation":"Reference read preserves per-reference ID aliases. Metadata reads use bookmark list (not log) to preserve label scopes; choose representative ref per target, group by remote, bound names/argv, concurrency 2. Currently publishes final Complete only on shared path; add progressive batches plus regression tests next.","scope":"User explicitly approved larger shared metadata read change via question.","tool_issue":"Discard of renamed sync module left a zero-byte untracked sync.ts shadowing sync.tsx. Removed that tool artifact before this run."}}
{"run":15,"commit":"f5baa71","metric":1324.938653,"metrics":{"stress_ms":978.453125,"real_ms":1794.120117,"highlighted_ms":1763.20105,"first_frame_ms":897.578125,"recovery_ms":12.750244},"status":"keep","description":"perf: stream shared bookmark descriptions in bounded concurrent groups","timestamp":1788969185827,"segment":0,"confidence":5.992400018975495,"asi":{"hypothesis":"Publish fully hydrated reference prefixes as metadata arrives while evaluating each target once","observations":"Primary improves another 2.3%; real median1794ms. Progressive display restored without marking Complete before all metadata streams finish.","validation":"11 new tests cover shared targets, argument bounds, out-of-order groups, immutable snapshots, errors, cancellation of both active child streams, native remote/divergent/deleted/conflicted refs, custom colors and ID aliases. All unit tests and types pass.","correctness":"Only full128-hex operation IDs use multi-read optimization; symbolic/unpinned operations retain original single-read path. Metadata remains in bookmark_list scope and reference ID formatting stays per reference.","formatting":"Fixed previously retained tui.tsx Promise.all formatting."}}
{"run":16,"commit":"f5baa71","metric":1559.235474,"metrics":{"stress_ms":1110.508545,"real_ms":2189.281006,"highlighted_ms":2033.797241,"first_frame_ms":1015.305664,"recovery_ms":11.373657},"status":"discard","description":"Serialize hydrated-prefix publication after merging concurrent metadata sources","timestamp":1788969395104,"segment":0,"confidence":4.894181216472643,"asi":{"hypothesis":"Joining after the concurrent stream merge gives an explicit monotonic publication guarantee and avoids shared producer-side state","rollback_reason":"Measured primary worse than best amid high variation; save correctness hardening for next candidate rather than claiming a speed win","next_action_hint":"Reapply .auto/publication-order.patch with next shared-read optimization. This is a correctness hardening requirement, not an optional speed tweak. Try fewer metadata subprocess setup costs or bounded concurrency4.","validation":"17 tests pass including native default/all-remotes, errors, symbolic operations, missing metadata fallback, cancellation. Native test now checks monotonic prefix lengths.","risk":"Producer-side accumulator in retained version constructs snapshots before merged delivery; ordering should be made explicit even though native tests pass."}}
{"run":17,"commit":"b6c5c2e","metric":1214.073586,"metrics":{"stress_ms":1039.941162,"real_ms":1417.363525,"highlighted_ms":1600.642944,"first_frame_ms":848.83728,"recovery_ms":10.895996},"status":"keep","description":"perf: read up to four independent bookmark target groups concurrently","timestamp":1788969480213,"segment":0,"confidence":4.14867933315992,"asi":{"hypothesis":"Use bounded concurrency4 to overlap independent pinned metadata groups while keeping prefix joins downstream of the merge","observations":"Real startup improves to1417ms, primary1214ms. Stress1039ms roughly baseline; one slow stress sample1517ms confirms remaining environmental variation.","validation":"17 regression tests plus full unit suite and types pass. Includes prior publication-order hardening and symbolic-operation safeguards.","correctness":"No producer-side shared accumulator; prefixes are constructed only after merged delivery, so publication cannot reorder snapshots.","next_action_hint":"Verify A/B/A with shared path disabled temporarily, plus third small fixture and E2E. Do not tune concurrency solely against one large fixture."}}
{"run":18,"commit":"b6c5c2e","metric":0,"metrics":{"stress_ms":0,"real_ms":0,"highlighted_ms":0,"first_frame_ms":0,"recovery_ms":0},"status":"crash","description":"Original-source A comparison interrupted before completion","timestamp":1788969647365,"segment":0,"confidence":4.14867933315992,"asi":{"hypothesis":"Verify retained startup improvement against original source in a separate workspace","rollback_reason":"User interrupted the run; no valid measurement was produced","next_action_hint":"User now requests one bundled-binary startup run. Pause optimization loop and measure the installed executable separately without comparing it as a like-for-like source result."}}
{"type":"config","name":"Single release-settings bundled Kajji startup on copied real repository","metricName":"binary_startup_ms","metricUnit":"ms","bestDirection":"lower"}
{"run":19,"commit":"1d59017","metric":2015.60400390625,"metrics":{"highlighted_ms":2015.60400390625,"first_frame_ms":1259.943115234375,"first_visible_ms":1293.928955078125,"bookmarks_ms":2015.60400390625,"log_ms":1716.518798828125,"diff_ms":1392.136962890625,"peak_rss_mib":259.1875},"status":"keep","description":"Single release-settings bundled-binary startup measurement on copied real repository","timestamp":1788969832078,"segment":1,"confidence":null,"asi":{"hypothesis":"Measure actual compiled startup separately from source launches, as requested","scope":"Exactly one measured bundled launch, no warmup. Built current code with same minify, conditions, worker entrypoint and compile flags as scripts/build.ts. Installed binary not replaced.","observations":"Content and highlighting ready2015.6ms; first visible1293.9ms. This one sample is not a stable comparison with source medians. First bundled launch may include OS binary validation and cold executable pages.","readiness":"Same frame observer, content readiness conditions, fixture copy policy, terminal dimensions and navigation validation. Local adapter changes only launch argv and module import paths.","binary":".kajji-benchmarks/startup-auto/bundled/kajji","report":".kajji-benchmarks/startup-auto/bundled/single-run.json","next_action_hint":"User requested a single run and pause. Do not resume optimization loop without a new request. Use compiled baseline for future optimization if requested."}}
{"run":20,"commit":"8db864f","metric":897.06103515625,"metrics":{"highlighted_ms":897.06103515625,"first_frame_ms":227.205322265625,"first_visible_ms":240.67529296875,"bookmarks_ms":897.06103515625,"log_ms":635.707763671875,"diff_ms":343.8984375,"peak_rss_mib":265.15625},"status":"keep","description":"Verify bundled startup with a second launch of the unchanged executable","timestamp":1788969920840,"segment":1,"confidence":null,"asi":{"hypothesis":"The first newly compiled binary launch includes extra executable loading or OS validation costs that may not recur","observations":"Identical SHA256 executable: content startup dropped2015.6→897.1ms, first frame1259.9→227.2ms. Most of the difference occurs before the first frame. This is measurement verification, NOT a code optimization.","uncertainty":"Cannot isolate OS validation, executable page caching, and reduced machine load from two samples. Load average decreased from prior high contention. Do not claim a55.5% code improvement.","validation":"Same copied fixture,2898 references,100 revisions,frame readiness and navigation checks; all unit tests and typechecks pass.","first_report":".kajji-benchmarks/startup-auto/bundled/first-launch.json","repeat_report":".kajji-benchmarks/startup-auto/bundled/single-run.json","next_action_hint":"Future compiled comparisons need equal first-launch/warmup policy and repeated processes across both real and stress fixtures. Rebuild after every source change; never measure a stale binary."}}
{"type":"config","name":"Compiled Kajji startup with equal warmup across stress and real repositories","metricName":"bundled_startup_ms","metricUnit":"ms","bestDirection":"lower"}
{"run":21,"commit":"d36c41f","metric":453.3239479122971,"metrics":{"stress_ms":263.179443359375,"real_ms":780.845947265625,"first_visible_ms":187.3865966796875,"first_frame_ms":165.9281005859375,"highlighted_ms":875.975830078125,"recovery_ms":11.973388671875,"peak_rss_mib":274.546875},"status":"keep","description":"Baseline compiled startup with one warmup and three measured processes per workload","timestamp":1789028045488,"segment":2,"confidence":null,"asi":{"hypothesis":"Equal warmup and repeated compiled launches provide a fairer optimization baseline than first launches or source runs","validation":"Rebuilt current source with release settings; one excluded warmup per fixture; three measured fresh processes each. Fixtures and readiness conditions unchanged. Full tests and typecheck pass.","observations":"Real content median780.8ms; stress263.2ms. Combined453.3ms is geometric mean, not a directly observed launch. Average per-fixture first-visible median187.4ms. No source code change or claimed optimization.","next_action_hint":"Now test Oniguruma on compiled workload; source discard was on a different target. Preserve all languages, themes, fallback and correctness checks. Do not compare new segment numerically with source or single-launch segments."}}
