{"run":53,"commit":"f26c057","metric":376.29642292776924,"metrics":{"binary_mib":101.84556770324707,"stress_ms":208.884033203125,"real_ms":677.88330078125,"first_visible_ms":147.765625,"first_frame_ms":127.2877197265625,"highlighted_ms":796.220947265625,"recovery_ms":10.3331298828125,"peak_rss_mib":275.28125},"status":"discard","description":"Start repository inspection and App import before syntax worker creation","timestamp":1789034071927,"segment":2,"confidence":2.6544561855680904,"asi":{"hypothesis":"Overlap syntax worker construction with already-started repository inspection and App import instead of paying worker creation before both","rollback_reason":"Primary376.30ms is2.0% above historical best369.03ms. No new best established.","validation":"Worker still initializes before first render; all content/highlighting/navigation requirements and full tests/types pass. No readiness hooks or benchmark conditions changed.","observations":"Real677.88ms approaches best672.46ms, stress208.88ms vs202.51ms; highlighting796.22ms vs783.27ms. First-frame127.29ms does not show a large construction-order saving.","next_action_hint":"Do not retry construction ordering unchanged. Recent smaller candidates are close to the historical minimum, but a clear mechanism with larger saved work is needed rather than repeated timing trials."}}
{"run":54,"commit":"f26c057","metric":373.56821238514226,"metrics":{"binary_mib":101.78257942199707,"stress_ms":207.527099609375,"real_ms":672.457763671875,"first_visible_ms":143.8060302734375,"first_frame_ms":125.2252197265625,"highlighted_ms":793.9354248046875,"recovery_ms":5.928466796875,"peak_rss_mib":276.921875},"status":"discard","description":"Enable code splitting in compiled release ESM-bytecode builds","timestamp":1789034177856,"segment":2,"confidence":2.803501726666833,"asi":{"hypothesis":"Code splitting may reduce duplicated app/worker bundle code and improve loading of release bytecode","rollback_reason":"Primary373.57ms is1.2% above best369.03ms; no primary improvement. Binary reduction only0.063MiB.","validation":"Bun1.4.2 compiled and launched split ESM bytecode successfully, including worker highlighting and navigation. Full checks passed. Builder reads splitting from actual release recipe so rollback restores unsplit build automatically; fixtures/readiness/warmups unchanged.","observations":"Real672.46ms matches historical best workload median; stress207.53ms vs202.51ms. First-frame125.23ms essentially unchanged. Recovery improved in this sample but is secondary and insufficient to retain.","next_action_hint":"Do not retry splitting unchanged. Minimal size difference does not support a large duplicate-code bottleneck. Do not chase the remaining1% with repeated samples."}}
{"run":55,"commit":"f26c057","metric":388.8731073171293,"metrics":{"binary_mib":101.84556770324707,"stress_ms":209.33837890625,"real_ms":722.382080078125,"first_visible_ms":147.5606689453125,"first_frame_ms":127.07080078125,"highlighted_ms":820.6920166015625,"recovery_ms":12.7625732421875,"peak_rss_mib":273.171875},"status":"discard","description":"Use Shiki token-only API instead of constructing unused result metadata","timestamp":1789034341560,"segment":2,"confidence":2.904523354762528,"asi":{"hypothesis":"codeToTokensBase avoids unused theme-result and grammar-state wrapper work for each worker line while retaining the same tokenization path","rollback_reason":"Primary388.87ms is5.4% above best369.03ms; no demonstrated startup gain.","validation":"Upstream single-theme codeToTokens delegates token creation to codeToTokensBase; worker consumes only token content/color. Full multilingual suite, types and compiled readiness/navigation passed. No benchmark or readiness changes.","observations":"Highlighting820.69ms also above best783.27ms. Small wrapper allocation savings are insufficient to demonstrate a primary benefit amid workload variation.","next_action_hint":"Do not retry token-only wrapper removal unchanged. A potentially larger future syntax improvement is build-time grammar precompilation, but investigate existing tooling and seek approval before adding dependencies or large generated artifacts."}}
{"run":56,"commit":"f26c057","metric":375.475967006402,"metrics":{"binary_mib":106.60118293762207,"stress_ms":207.400634765625,"real_ms":679.7578125,"first_visible_ms":156.0400390625,"first_frame_ms":127.3724365234375,"highlighted_ms":691.46240234375,"recovery_ms":11.81640625,"peak_rss_mib":269.1875},"status":"discard","description":"Use matching precompiled Shiki grammars and the raw JavaScript engine","timestamp":1789034664316,"segment":2,"confidence":3.0661910480499324,"asi":{"hypothesis":"Precompiled regular expressions remove runtime Oniguruma-to-JavaScript conversion while retaining all configured grammars","rollback_reason":"Primary375.48ms is1.75% above historical best369.03ms. Highlighting improvement is secondary, and binary grows101.85→106.60MiB.","scope":"User explicitly approved precompiled-grammar dependency and worker-build experiments. Added exact @shikijs/langs-precompiled4.4.3 to match existing Shiki4.4.3; package manifest and lockfile revert with candidate.","validation":"All configured languages/themes passed existing multilingual tests; full types/tests and compiled highlighting/navigation/readiness pass. Upstream warns of known precompiled-language compatibility issues, so these tests are not exhaustive proof of identical syntax colors.","observations":"Highlighting-ready691.46ms vs historical783.27ms, peakRSS269.19MiB vs275.75MiB; real679.76ms vs672.46ms. Potential highlighting tradeoff, not a primary startup win.","next_action_hint":"Do not retry unchanged. Before revisiting precompiled grammars, add exact token/color comparisons across difficult multiline grammars and known upstream issue cases. Keep size and compatibility caveats visible."}}
