{"run":22,"commit":"265c0d0","metric":431.1608529649411,"metrics":{"stress_ms":266.09375,"real_ms":698.624755859375,"first_visible_ms":187.284423828125,"first_frame_ms":165.0252685546875,"highlighted_ms":525.643798828125,"recovery_ms":11.0955810546875,"peak_rss_mib":346.9375},"status":"keep","description":"perf: use Oniguruma for bundled syntax highlighting","timestamp":1789028144464,"segment":2,"confidence":null,"asi":{"hypothesis":"Oniguruma avoids first-use JavaScript regex compilation and reduces startup CPU contention in the compiled executable","revisits_run":11,"observations":"New compiled target and equal warmup policy: primary improves4.9%; real781→699ms, stress263→266ms. Highlighted median average876→526ms. Peak sampled RSS275→347MiB (+26%) is a tradeoff, not catastrophic.","validation":"Compiled release with inlined WASM loads successfully, all measured launches reach syntax readiness and navigate correctly. Full unit tests and types pass. No language/theme/fallback/readiness changes.","next_action_hint":"Expand multilingual worker tests and repeat against JavaScript engine under same compiled workload before attributing small primary win. Investigate RSS increase; do not claim same colors for every grammar without checking."}}
{"run":23,"commit":"265c0d0","metric":437.1266587269957,"metrics":{"stress_ms":256.137939453125,"real_ms":746.003173828125,"first_visible_ms":188.3778076171875,"first_frame_ms":169.45166015625,"highlighted_ms":544.3331298828125,"recovery_ms":12.5596923828125,"peak_rss_mib":353.671875},"status":"checks_failed","description":"Test Shiki core imports with multilingual worker regression coverage","timestamp":1789028295468,"segment":2,"confidence":3.715021211103464,"asi":{"hypothesis":"Core-only Shiki imports might avoid full registry initialization in the compiled worker","revisits_run":10,"rollback_reason":"New test samples inferred as string[][] rather than tuples, causing typecheck failure. Benchmark also worse than retained431ms and memory unchanged/worse.","next_action_hint":"Do not retry core alone. Restore .auto/multilingual-tests.patch and type samples as [string,string][]; verify retained full-factory Oniguruma behavior and memory before new changes.","validation":"Runtime multilingual test passed all30 languages and both themes243 assertions, but static typecheck correctly rejected the test. Full suite stopped before execution."}}
{"run":24,"commit":"47c6823","metric":428.0580380055849,"metrics":{"stress_ms":256.400634765625,"real_ms":714.63818359375,"first_visible_ms":187.79150390625,"first_frame_ms":165.7640380859375,"highlighted_ms":531.918212890625,"recovery_ms":11.168701171875,"peak_rss_mib":346.3125},"status":"keep","description":"test: cover all bundled syntax languages and verify Oniguruma startup again","timestamp":1789028429078,"segment":2,"confidence":5.572161563016963,"asi":{"hypothesis":"Retained Oniguruma should repeat its compiled startup benefit and preserve colored text in all configured languages","validation":"Thirty languages times two themes preserve complete source text and produce multiple token colors. Includes Unicode, long-line and unknown-language fallbacks. Corrected tuple typing; all unit tests and typecheck pass.","observations":"Primary428.1ms vs prior431.2ms; real714.6ms vs698.6ms. Repeat close enough to support stability but not an additional code speed claim. Memory346MiB confirms tradeoff persists.","next_action_hint":"A/B/A JavaScript engine control with same rebuilt compiled protocol. Expanded test may expose preexisting JS grammar fallback; do not weaken it."}}
{"run":25,"commit":"47c6823","metric":438.05453301504053,"metrics":{"stress_ms":271.53564453125,"real_ms":706.69091796875,"first_visible_ms":187.681884765625,"first_frame_ms":165.510498046875,"highlighted_ms":834.9581298828125,"recovery_ms":10.2586669921875,"peak_rss_mib":276.546875},"status":"discard","description":"A comparison: restore JavaScript regex engine under the same compiled workload","timestamp":1789028496944,"segment":2,"confidence":4.2351211075988635,"asi":{"hypothesis":"Check whether the apparent Oniguruma startup gain survives an original-engine A comparison","rollback_reason":"JavaScript primary438.1ms is2.3% worse than retained428.1ms; restore Oniguruma. Both engines pass all multilingual checks.","observations":"Real startup707ms is nearly equal to Oniguruma715ms, unlike first baseline781ms. Most original10% real gain was environmental. Highlighting834.96ms vs531.92ms remains a clear difference. Memory276.55MiB vs346.31MiB confirms about70MiB cost.","next_action_hint":"Report primary benefit as small/inconclusive, highlighting improvement as strong. Seek reduced Oniguruma memory or unrelated startup bottleneck; do not claim6% proven primary gain."}}
{"run":26,"commit":"47c6823","metric":569.5422153144668,"metrics":{"stress_ms":349.068359375,"real_ms":929.268798828125,"first_visible_ms":217.0521240234375,"first_frame_ms":193.900146484375,"highlighted_ms":714.2603759765625,"recovery_ms":10.810302734375,"peak_rss_mib":343.546875},"status":"discard","description":"Wait for the initial log stream before viewport prefetch requests an expanded page","timestamp":1789028831692,"segment":2,"confidence":3.1656977610404797,"asi":{"hypothesis":"Avoid canceling useful initial-page work when prefetch sees a partially streamed log","rollback_reason":"Primary startup33% above best; sequentially completing initial and expanded pages did not improve end-to-end timing. First frame also slower, so environmental load may contribute.","next_action_hint":"If revisited, investigate viewport prefetch demand itself and response to user navigation, not this sequential wait alone. Do not reduce initial data or change readiness just to improve metric.","validation":"Regression test proved initial51-record stream completes without cancellation, two concurrent expansion requests coalesce into one101-record request, final100 commits preserved. Tests and typecheck passed.","implementation":"logStreamHandle typed as ReturnType<typeof app.jjStreamLogPage>; await its result and recheck token/hasMore/loadingMore before expansion."}}
{"run":27,"commit":"47c6823","metric":1071.8748914441646,"metrics":{"stress_ms":361.62890625,"real_ms":3177.057373046875,"first_visible_ms":217.0009765625,"first_frame_ms":197.1119384765625,"highlighted_ms":2174.3809814453125,"recovery_ms":15.9337158203125,"peak_rss_mib":421.8125},"status":"discard","description":"Compiled A comparison against original pre-experiment source996dbf68","timestamp":1789028968655,"segment":2,"confidence":2.5274768689238862,"asi":{"hypothesis":"The shared bookmark optimization should improve release binaries, not only source launches","rollback_reason":"Original compiled source substantially slower than retained candidate; this run is a control, not a proposed change","observations":"Original real content median3177ms vs candidate715ms; stress362ms vs256ms. Original samples variable2789–3385ms and first-frame slower suggest environment affects magnitude, but difference is much larger than variation.","source":"Built untouched996dbf68 via /tmp/kajji-startup-e2e-baseline. Same compiler/dependencies/flags/output path and same fixtures, warmups, readiness and navigation. .auto/build-binary.ts now accepts KAJJI_BUILD_ROOT for explicit source comparisons.","next_action_hint":"Rebuild current candidate with no KAJJI_BUILD_ROOT and run B repeat now. Current binary on disk is the original-source control; must not use it as current code."}}
{"run":28,"commit":"47c6823","metric":638.0871255819319,"metrics":{"stress_ms":382.85791015625,"real_ms":1063.462890625,"first_visible_ms":249.80615234375,"first_frame_ms":222.7666015625,"highlighted_ms":783.5858154296875,"recovery_ms":12.44482421875,"peak_rss_mib":331.265625},"status":"discard","description":"Rebuild retained candidate after original-source compiled control","timestamp":1789029034247,"segment":2,"confidence":1.57128308791516,"asi":{"hypothesis":"A following current-code repeat should confirm the large original-vs-candidate difference despite machine load","rollback_reason":"Verification only; slower than session best, with no application changes to revert","observations":"Current real1063ms vs adjacent original3177ms: ~66.5% lower. Stress383ms vs original362ms is slightly worse. First frame223ms vs197ms confirms current was not measured under a generally faster environment. Large real-repo benefit survives; exact speed claims remain workload-specific.","next_action_hint":"Keep compiled first-visible and complete-data metrics distinct. Current code rebuilt correctly on disk. Investigate smaller or no-shared-target fixtures for extra-read regressions; use separate validation not silently alter primary."}}
{"run":29,"commit":"47c6823","metric":462.7291721339385,"metrics":{"stress_ms":273.05810546875,"real_ms":784.149169921875,"first_visible_ms":189.7041015625,"first_frame_ms":172.073486328125,"highlighted_ms":582.088623046875,"recovery_ms":10.7718505859375,"peak_rss_mib":355.875},"status":"discard","description":"Use Bun small-heap mode for the syntax worker","timestamp":1789029172347,"segment":2,"confidence":1.139999172801739,"asi":{"hypothesis":"Worker smol:true could reduce JavaScriptCore heap residency and offset Oniguruma memory cost","rollback_reason":"Primary8.1% above best and peakRSS356MiB did not improve relative346MiB. No useful tradeoff.","source":"Updated /tmp/bun and inspected WorkerOptions: smol selects smaller JavaScriptCore heap, explicitly may slow worker.","validation":"Compiled launches, syntax readiness, navigation, full tests and types pass.","next_action_hint":"Do not retry small heap unchanged. Memory overhead likely outside worker JS heap (WASM/JIT/retained data). Consider diagnostic allocation profiling separately; maintain primary startup focus."}}
{"run":30,"commit":"47c6823","metric":550.1632285709344,"metrics":{"stress_ms":333.87109375,"real_ms":906.576171875,"first_visible_ms":216.972412109375,"first_frame_ms":194.35888671875,"highlighted_ms":683.358642578125,"recovery_ms":9.813720703125,"peak_rss_mib":348.453125},"status":"discard","description":"Start PR metadata reads once bookmark streaming completes instead of per partial batch","timestamp":1789029411738,"segment":2,"confidence":0.8891089161447131,"asi":{"hypothesis":"Avoid repeated git-origin resolution, GraphQL query construction and canceled gh processes during bookmark streaming","rollback_reason":"Primary550ms is28.5% above best; no measured startup improvement. Environment slower before first frame too, but cannot claim a gain.","validation":"Deterministic test confirmed partial bookmarks remain visible and only one PR query starts with both heads after completion. Tests and types pass. No benchmark/readiness changes or benchmark-specific condition.","next_action_hint":"May be useful separate network-efficiency improvement in authenticated usage, but not supported by current local-startup metric. Do not retry unchanged.","implementation":"Internal bookmarksRefreshing signal true for every initial/refresh stream; PR effect returns while active; matching-token finally clears signal."}}
{"run":31,"commit":"47c6823","metric":0,"metrics":{"stress_ms":0,"real_ms":0,"first_visible_ms":0,"first_frame_ms":0,"highlighted_ms":0,"recovery_ms":0,"peak_rss_mib":0},"status":"crash","description":"Enable bytecode precompilation in the release build recipe","timestamp":1789030036715,"segment":2,"confidence":0.8891089161447131,"asi":{"hypothesis":"Build-time bytecode compilation moves JavaScript parsing out of process startup","rollback_reason":"Bun1.4.2 rejected top-level await in index.tsx with bytecode enabled under implicit output format. Build failed before any benchmark launch.","next_action_hint":"Explicit ESM output may be required. Check installed runtime behavior; current upstream docs support ESM+compile but may be newer. Do not drop async startup/error handling to force a build.","scope":"User explicitly approved experimenting with release-build options. .auto builder reads bytecode flag from production scripts/build.ts so failed/reverted flag cannot persist secretly.","baseline_binary_mib":84.42930793762207}}
{"run":32,"commit":"34a3b4f","metric":379.8156715048481,"metrics":{"binary_mib":101.62510871887207,"stress_ms":210.8515625,"real_ms":684.177734375,"first_visible_ms":155.686279296875,"first_frame_ms":130.904296875,"highlighted_ms":490.1529541015625,"recovery_ms":13.471435546875,"peak_rss_mib":369.84375},"status":"keep","description":"perf: precompile ESM bytecode in release binaries","timestamp":1789030125009,"segment":2,"confidence":2.9093856773359468,"asi":{"hypothesis":"Explicit ESM format lets bytecode precompilation retain top-level await and reduce parsing at startup","revisits_run":31,"observations":"Primary379.8ms improves11.3% from best428.1ms. First-visible average156ms vs188ms; stress211ms vs256ms; real684ms vs715ms. Binary grows84.43→101.63MiB (~20%); peakRSS370MiB vs346MiB.","validation":"Bun1.4.2 compiled successfully with format:esm,bytecode:true; source/worker top-level await retained. All compiled readiness and navigation checks plus unit tests and types pass.","changed_assumption":"Initial failure was default CJS output, not lack of ESM bytecode support. Current Bun source explicitly defaults bytecode to CJS unless format supplied.","next_action_hint":"Verify CLI help/version and compiled build portable behavior, then repeated bytecode control. Include binary size as a valuable tradeoff monitor; production build recipe and experiment builder both use same options."}}
{"run":33,"commit":"426b48e","metric":378.97998441214366,"metrics":{"binary_mib":101.62510871887207,"stress_ms":209.07177734375,"real_ms":686.968994140625,"first_visible_ms":156.5450439453125,"first_frame_ms":130.4249267578125,"highlighted_ms":490.22509765625,"recovery_ms":11.0164794921875,"peak_rss_mib":370.359375},"status":"keep","description":"Verify release ESM bytecode startup with a fresh rebuild and repeated launches","timestamp":1789030229746,"segment":2,"confidence":1.7805919886657702,"asi":{"hypothesis":"The bytecode startup gain should survive a fresh rebuild with the same warmup policy","observations":"Primary379.0ms closely repeats379.8ms; real687ms,stress209ms,first-visible156.5ms. Size101.625MiB and peakRSS370MiB stable.","validation":"Compiled --version and --help succeeded outside repository bunfig scope. All benchmark navigation/readiness checks, multilingual tests, full unit suite and types pass.","next_action_hint":"A control without bytecode can quantify ~35ms first-frame gain; also run E2E separately. Need cross-platform build checks before claiming all release targets validated."}}
{"run":34,"commit":"426b48e","metric":439.1004436054809,"metrics":{"binary_mib":84.42930793762207,"stress_ms":260.958740234375,"real_ms":738.849365234375,"first_visible_ms":189.084716796875,"first_frame_ms":166.4000244140625,"highlighted_ms":544.0526123046875,"recovery_ms":12.801025390625,"peak_rss_mib":360},"status":"discard","description":"A control: disable release bytecode while retaining explicit ESM format","timestamp":1789030294356,"segment":2,"confidence":3.1463378747026622,"asi":{"hypothesis":"Isolate bytecode benefit from explicit ESM output and environment variation","rollback_reason":"Without bytecode primary439.1ms vs379.0ms (+15.9%), first frame166.4ms vs130.4ms (+36ms). Restore bytecode.","observations":"This control supports a real parsing/startup benefit on both workloads: stress261ms vs209ms, real739ms vs687ms. Binary84.43MiB vs101.63MiB confirms disk-size tradeoff.","next_action_hint":"Restore/rebuild bytecode for final artifacts. Run correctness/E2E and cross-target compilation checks without changing benchmark readiness."}}
{"run":35,"commit":"f26c057","metric":369.027526541109,"metrics":{"binary_mib":101.84556770324707,"stress_ms":202.51318359375,"real_ms":672.45654296875,"first_visible_ms":138.9285888671875,"first_frame_ms":125.1358642578125,"highlighted_ms":783.2650146484375,"recovery_ms":9.94580078125,"peak_rss_mib":275.75},"status":"keep","description":"perf: use JavaScript highlighting with release bytecode to reduce startup memory","timestamp":1789030537020,"segment":2,"confidence":2.033358155948189,"asi":{"hypothesis":"ESM bytecode changes JavaScript engine startup costs enough to reconsider the previous Oniguruma tradeoff","revisits_run":25,"observations":"Same rebuilt compiled protocol: primary369.0ms vs379.0ms (-2.6%), stress202.5ms vs209.1ms, real672.5ms vs687.0ms. PeakRSS275.75MiB vs370.36MiB (-25.5%). Highlighting-ready average worsens490.2→783.3ms; explicit tradeoff, still below original compiled baseline876ms.","validation":"All30 configured languages and both themes preserve text and produce multiple token colors; full unit suite/typecheck and compiled readiness/navigation pass. No changes to fixtures, warmups, readiness, data, language list or fallback.","changed_assumption":"Prior JavaScript control had bytecode disabled. This candidate retains production format:esm,bytecode:true and rebuilds both app and worker before every measurement.","next_action_hint":"Repeat before claiming the small primary improvement as causal. Keep highlighting delay visible; primary content improvement plus large memory reduction justified retaining this candidate, not a blanket performance win."}}
{"run":36,"commit":"f26c057","metric":370.26096958128596,"metrics":{"binary_mib":101.84556770324707,"stress_ms":204.00341796875,"real_ms":672.01416015625,"first_visible_ms":147.328125,"first_frame_ms":124.8941650390625,"highlighted_ms":782.11083984375,"recovery_ms":12.9892578125,"peak_rss_mib":275.03125},"status":"discard","description":"Repeat JavaScript-engine plus bytecode candidate without application changes","timestamp":1789030656865,"segment":2,"confidence":1.4474256396038125,"asi":{"hypothesis":"Verify the small startup gain and large memory saving of JavaScript highlighting with bytecode after a fresh rebuild","rollback_reason":"Verification metric370.26ms is0.33% above best369.03ms; no application changes to revert and retained implementation stays unchanged.","observations":"Real content672.01ms repeats672.46ms; stress204.00ms vs202.51ms. PeakRSS275.03MiB repeats275.75MiB; highlighting782.11ms repeats783.27ms. Confirms the tradeoff, not a new optimization. First-visible observation differs8ms while first-frame essentially unchanged, consistent with sampling uncertainty.","validation":"Same compiler, release flags, warmups, fixtures, readiness and navigation; full unit suite including all languages/themes and typecheck passed.","next_action_hint":"Candidate appears repeatable. Further work should address a distinct bottleneck rather than keep toggling engines. Keep exact installed-repo behavior and first-visible vs complete-data metrics separate."}}
{"run":37,"commit":"f26c057","metric":397.1319895868569,"metrics":{"binary_mib":101.84556770324707,"stress_ms":225.04345703125,"real_ms":700.81494140625,"first_visible_ms":150.5540771484375,"first_frame_ms":128.3472900390625,"highlighted_ms":825.160888671875,"recovery_ms":10.286865234375,"peak_rss_mib":276.625},"status":"discard","description":"Overlap independent Git repository inspection and jj refresh-state reads","timestamp":1789030867573,"segment":2,"confidence":1.7162453759551182,"asi":{"hypothesis":"After root resolution, overlap the read-only Git repository probe with jj state inspection to remove one sequential process wait","rollback_reason":"Primary397.13ms is7.6% slower than best369.03ms. Both workload medians worsened; no measured benefit.","validation":"Three deterministic regression tests cover actual overlap, non-jj paths and state errors. Full types/tests and compiled readiness/navigation checks passed. Workloads, warmups, data and readiness unchanged.","observations":"Real samples700.81,686.46,1578.37ms show environmental variation. Do not infer that concurrency inherently causes the slowdown, but do not retain an unsupported optimization.","next_action_hint":"Do not retry this small overlap unchanged. Seek substantial repeated work on the post-first-frame path rather than small process scheduling changes."}}
{"run":38,"commit":"f26c057","metric":401.6426373872649,"metrics":{"binary_mib":101.84556770324707,"stress_ms":214.939697265625,"real_ms":750.521240234375,"first_visible_ms":156.5938720703125,"first_frame_ms":132.044677734375,"highlighted_ms":840.2823486328125,"recovery_ms":14.922119140625,"peak_rss_mib":278.84375},"status":"discard","description":"Cache loaded syntax languages once instead of rebuilding the list for each line","timestamp":1789032166226,"segment":2,"confidence":2.107691429470732,"asi":{"hypothesis":"Replace repeated language-list allocation and linear lookup during per-line tokenization with one Set built after full highlighter initialization","rollback_reason":"Primary401.64ms is8.8% slower than best369.03ms. No measured startup or highlighting improvement.","validation":"Full unit suite and types passed, including multilingual coverage. Formatting passed. Same rebuilt release binary protocol, all languages and aliases captured from initialized highlighter, no readiness or fixture changes.","observations":"First-frame132ms vs125ms also slower before this lookup matters; environmental variation may contribute. This is not evidence that Set lookup itself is slower.","next_action_hint":"Do not retry the language lookup cache unchanged. Small allocation optimizations have not improved startup; inspect expensive repeated command or rendering work before the next candidate."}}
